{
  "schema_version": "0.1-draft",
  "type_id": "calculator",
  "type_version": "0.1.0",
  "roles": [
    "resource"
  ],
  "operations": {
    "calculate": {
      "mcp_tool": "calculate",
      "input_schema": {
        "type": "object",
        "properties": {
          "expression": {
            "type": "string",
            "minLength": 1,
            "maxLength": 4096
          }
        },
        "required": [
          "expression"
        ],
        "additionalProperties": false
      },
      "output_schema": {
        "type": "object",
        "properties": {
          "expression": {
            "type": "string",
            "minLength": 1,
            "maxLength": 4096
          },
          "value": {
            "type": "string",
            "minLength": 1,
            "maxLength": 4096
          }
        },
        "required": [
          "expression",
          "value"
        ],
        "additionalProperties": false
      }
    }
  },
  "config_schema": {
    "type": "object",
    "properties": {
      "max_expression_bytes": {
        "type": "integer",
        "minimum": 1,
        "maximum": 4096,
        "default": 4096
      },
      "max_nodes": {
        "type": "integer",
        "minimum": 1,
        "maximum": 128,
        "default": 128
      },
      "max_exponent": {
        "type": "integer",
        "minimum": 0,
        "maximum": 100,
        "default": 100
      },
      "max_result_bytes": {
        "type": "integer",
        "minimum": 1,
        "maximum": 4096,
        "default": 4096
      }
    },
    "additionalProperties": false
  },
  "resource_slots": {},
  "execution": {
    "state_scope": "none",
    "concurrency": "independent"
  },
  "billing": "none"
}
